product_id,name,price,category,affiliate_url
2269b1c5-96dc-4c00-a55b-c61d10381a62,"TAMA 올인원 Ai 화이트, 단품",597990,로봇청소기,
9fc412e9-fe67-487c-9a60-46eaedceae2c,"에브리봇 올인원 로봇청소기 Q9 화이트, 단품",659000,로봇청소기,
aaeccf46-d3c8-4641-ad63-1a7a9254e916,"[2026신제품] 드리미 L10s Ultra Gen3 로봇청소기 사이드 브러시 엉킴 방지 열풍건조",699000,로봇청소기,
235994c1-6f53-4a34-a559-4b0998887a4a,"에코백스 디봇 T80 옴니 화이트, 단품",799000,로봇청소기,
31149f89-3a84-4aef-ad93-bf2bfef77436,"에브리봇 Q11 화이트, 단품",849000,로봇청소기,
32490887-a99c-42de-9c0b-93d5994d7ed2,"삼성전자 BESPOKE 스팀 9600 로봇청소기 방문설치",897620,로봇청소기,
2e99e15d-5df2-40e0-a599-82ab5dc5c792,"드리미 X50s Pro Ultra 화이트, 단품",989990,로봇청소기,
18c792c3-b54c-45a5-b77d-ae7a49c1baf6,"삼성비스포크 스팀물걸레 AI 로봇청소기 + 스팀청정스테이션",1184000,로봇청소기,
4eeaaf48-7126-427f-8945-55c50af664c2,"로보락 Qrevo Curv 2 Flow 화이트, 단품",1190000,로봇청소기,
c60ed953-ce2f-438d-9059-0316af3ccdb8,"드리미 X50s Pro Master 블랙, 단품",1307690,로봇청소기,
bf6f0d66-e8e9-469a-a4b0-475f91edd2a2,"베이스어스 BP1 PRO 노이즈캔슬링 이어폰",29900,블루투스 이어폰,
12af2aca-241e-4bd1-880c-084cd689cbb8,"브리츠 StormTWS7",32900,블루투스 이어폰,
91df33ab-8ae0-4976-9398-bd845a0c8360,"브리츠 ProPods5Plus",34900,블루투스 이어폰,
6f2a5944-4909-4419-b363-cfaf345522e2,"QCY QCY-HT08",41500,블루투스 이어폰,
f1aa0be8-88ec-45e5-a70e-cfddd6faf081,"브리츠 BZ-Fit3",42900,블루투스 이어폰,
7ec0ed6d-dcf6-4352-90c6-a39347b8a75a,"QCY CT06 오픈형 귀찌 무선 블루투스 이어폰 귀안아픈 러닝 자전거 운동용 이어커프",42900,블루투스 이어폰,
37e6baf8-a038-4ef7-a7b0-648ef559172b,"로랜텍 RSM-R540",43820,블루투스 이어폰,
765679a0-4099-437b-a015-03542537f971,"브리츠 Realfit5",47090,블루투스 이어폰,
c1cc9829-9c58-46bf-8f33-9328da9ed17a,"베이스어스 Bowie MC1 오픈형 이어폰",49890,블루투스 이어폰,
1beb44f0-5ea2-4555-aaee-984048c2c125,"브리츠 오픈형 블루투스 이어폰 귀찌 귀걸이형 운동 러닝 무선 이어폰 노이즈 캔슬링",49900,블루투스 이어폰,
47aaa873-413c-45f3-a1f3-dd928a290272,"오아 퓨어 미니 공기청정기 OA-AP005 화이트",34800,공기청정기,
2d81b20f-f83a-43a4-a143-f63bb8ecdfd9,"위닉스 AT5M200-MWK 화이트",40810,공기청정기,
f63aea4a-1431-44b9-99ef-6fa23c30f98a,"홈스미스 미니공기청정기 원룸 소형 펫 고양이 강아지털 사무실 거실 안방 환기청정기 A1",48900,공기청정기,
c0f90206-00e1-441e-9cae-6b2c4e4953b1,"[호환] 필터모아 암웨이 공기청정기 필터 10-1076K 헤파 탈취 필터세트",52500,공기청정기,
72269120-d356-43f7-ac59-17e99462b187,"위닉스 타워엣지 AT8E430 화이트",65000,공기청정기,
7a57d007-07c3-437a-a8aa-d50c6b317eb2,"위닉스 타워 프라임 플러스 ATTM115 실버",75580,공기청정기,
151668cf-88ce-4394-a41e-8f320558d4b4,"하니웰 펫 공기청정기 고양이 털 냄새 알레르기 제거 HEPA필터 가정용 음이온 소형 공청기",489000,공기청정기,
e16d0f2d-af09-49bb-9703-019d7e074275,"쿠쿠전자 CUCKOO AC-28AHNL20F 어스 웜화이트",494900,공기청정기,
cf572795-56f6-4608-ab42-491ecba06467,"다이슨 쿨 공기청정기 PC2 화이트골드",591090,공기청정기,
92cf1f04-d0d9-4462-9e44-946e3c1791ec,"LG전자 LG퓨리케어 AI+ 360˚ 공기청정기 AS355N M 필터, 샌드 베이지, +무빙휠",1374890,공기청정기,
409b981b-c848-44a7-b057-af99dba8f15b,"스텐 스팀 에어프라이어 오븐형 에어프라이 대용량 에어후라이기",129000,에어프라이어,
f353dbdc-8f7d-4b28-8a54-cd51757120eb,"오아 보아르 에이블 듀얼 에어프라이어 실버",129000,에어프라이어,
4382f5ee-5b70-45b0-a9ee-a2069eee8956,"쿠쿠전자 CUCKOO CAFO-A1410TB 블랙",140100,에어프라이어,
c8dcb98a-2e3d-43b4-8621-4bbb8fc70a35,"박세리 오븐 에어프라이어 오븐형 대용량 올스텐 에어후라이기 포미",174000,에어프라이어,
7cc5b350-f698-4854-b39e-c60c70789877,"코렐 일렉 크리스피 바사칸 에어글라스 에어프라이어 5세대",189000,에어프라이어,
255dd875-6e0c-449b-be55-59b7dfd31490,"라쿠진 LCZ2506WT 화이트",199000,에어프라이어,
86a299f5-73fc-4fbe-97f1-64f93efce205,"KAN DAROOM 올스텐 에어프라이어 23L 화이트",236550,에어프라이어,
0f882fa4-4d7b-41c4-8189-22ca9c0bdf11,"시즌앤홈 대용량 올스텐 에어프라이어 오븐형 30L",247900,에어프라이어,
7c4ecc28-ae83-44cd-81a0-6ba9c70d802b,"스테나 퓨어 304 스텐",297860,에어프라이어,
47cd04a8-ddb2-4cfb-8629-412559493432,"오넬리 듀얼 스팀 에어프라이어 오븐형 올스텐 대용량 에어프라이기 로티세리 자동세척 20L",399000,에어프라이어,
8e8c7205-8ae9-49e1-b6f4-ea5d8220ecba,"[무압력]한일 26년형 가열식 가습기 대용량 신생아 가열가습기 아기",184900,가습기,
08ecebf7-1f83-4edb-ba3b-e51327f0aada,"에디르 대용량 복합식 가습기 프로 화이트",198000,가습기,
60752cc5-92ec-4281-9463-70ab66facff8,"한일 프리미엄 가열식 가습기 신생아 아기 가습기 최신형 물멍 대용량 저소음 살균 화이트",199000,가습기,
9356dfa9-be7c-42cd-9c4f-e76c06bf1c61,"신일 대용량 가습기 초음파 통세척 사무실 거실 세척편한 대형 25L",239000,가습기,
582d623e-7724-415e-92f2-c66a4ebb27a2,"신일 25L 대용량 초음파 가습기 사무실 대형 거실 통세척 무소음 타워형 업소용 산업용",239000,가습기,
7b46b2cc-7366-4f31-9298-5408f7426cd9,"블루필 블랙크리스탈 가열식 가습기 대용량 올스텐 IH 온열 인덕션 신생아 아기 밥솥",245000,가습기,
437e4ff3-594c-40b0-934b-64b9e18a2b2f,"케어팟 가습기 X50V 화이트",269000,가습기,
f20f99da-16f2-4888-b37f-346ad101a946,"조지루시 가열식 가습기 대용량 4L 아기 신생아 220V",329000,가습기,
8044edfe-e1ff-43c4-84f0-92da895c955b,"스텐팟 6L 대용량 스텐 가열식 가습기 올스텐 신생아 아기 가습기 화이트",349000,가습기,
daf53e91-5c1d-4a9b-845f-6d9d60d5536d,"스테나 STN 100 그레이",398000,가습기,